    1   0.000000 192.168.1.59 → 255.255.255.255 UDP 125 50441 → 10505 Len=97
    2   0.417870    127.0.0.1 → 127.0.0.1    TCP 42 52533 → 9090 [PSH, ACK] Seq=1 Ack=1 Win=10003 Len=2
    3   0.417870    127.0.0.1 → 127.0.0.1    TCP 42 [TCP Retransmission] 52533 → 9090 [PSH, ACK] Seq=1 Ack=1 Win=10003 Len=2
    4   0.417870    127.0.0.1 → 127.0.0.1    TCP 40 9090 → 52533 [ACK] Seq=1 Ack=3 Win=10214 Len=0
    5   0.417870    127.0.0.1 → 127.0.0.1    TCP 40 [TCP Dup ACK 4#1] 9090 → 52533 [ACK] Seq=1 Ack=3 Win=10214 Len=0
    6   0.417870    127.0.0.1 → 127.0.0.1    TCP 42 9090 → 52533 [PSH, ACK] Seq=1 Ack=3 Win=10214 Len=2
    7   0.417870    127.0.0.1 → 127.0.0.1    TCP 44 52533 → 9090 [PSH, ACK] Seq=3 Ack=1 Win=10003 Len=4
    8   0.417870    127.0.0.1 → 127.0.0.1    TCP 42 [TCP Retransmission] 9090 → 52533 [PSH, ACK] Seq=1 Ack=3 Win=10214 Len=2
    9   0.417870    127.0.0.1 → 127.0.0.1    TCP 40 52533 → 9090 [ACK] Seq=7 Ack=3 Win=10002 Len=0
   10   0.417870    127.0.0.1 → 127.0.0.1    TCP 44 [TCP Retransmission] 52533 → 9090 [PSH, ACK] Seq=3 Ack=1 Win=10003 Len=4
   11   0.417870    127.0.0.1 → 127.0.0.1    TCP 40 52533 → 9090 [ACK] Seq=7 Ack=3 Win=10002 Len=0
   12   0.417870    127.0.0.1 → 127.0.0.1    TCP 40 9090 → 52533 [ACK] Seq=3 Ack=7 Win=10214 Len=0
   13   0.417870    127.0.0.1 → 127.0.0.1    TCP 40 [TCP Dup ACK 12#1] 9090 → 52533 [ACK] Seq=3 Ack=7 Win=10214 Len=0
   14   0.417870    127.0.0.1 → 127.0.0.1    TCP 46 52533 → 9090 [PSH, ACK] Seq=7 Ack=3 Win=10002 Len=6
   15   0.417870    127.0.0.1 → 127.0.0.1    TCP 46 [TCP Retransmission] 52533 → 9090 [PSH, ACK] Seq=7 Ack=3 Win=10002 Len=6
   16   0.417870    127.0.0.1 → 127.0.0.1    TCP 40 9090 → 52533 [ACK] Seq=3 Ack=13 Win=10214 Len=0
   17   0.417870    127.0.0.1 → 127.0.0.1    TCP 40 [TCP Dup ACK 16#1] 9090 → 52533 [ACK] Seq=3 Ack=13 Win=10214 Len=0
   18   0.417870    127.0.0.1 → 127.0.0.1    TCP 195 9090 → 52533 [PSH, ACK] Seq=3 Ack=13 Win=10214 Len=155
   19   0.417870    127.0.0.1 → 127.0.0.1    TCP 195 [TCP Retransmission] 9090 → 52533 [PSH, ACK] Seq=3 Ack=13 Win=10214 Len=155
   20   0.417870    127.0.0.1 → 127.0.0.1    TCP 40 52533 → 9090 [ACK] Seq=13 Ack=158 Win=10002 Len=0
   21   0.417870    127.0.0.1 → 127.0.0.1    TCP 40 [TCP Dup ACK 20#1] 52533 → 9090 [ACK] Seq=13 Ack=158 Win=10002 Len=0
   22   0.720578    127.0.0.1 → 127.0.0.1    TCP 42 9090 → 52533 [PSH, ACK] Seq=158 Ack=13 Win=10214 Len=2
   23   0.720578    127.0.0.1 → 127.0.0.1    TCP 42 [TCP Retransmission] 9090 → 52533 [PSH, ACK] Seq=158 Ack=13 Win=10214 Len=2
   24   0.720578    127.0.0.1 → 127.0.0.1    TCP 40 52533 → 9090 [ACK] Seq=13 Ack=160 Win=10002 Len=0
   25   0.720578    127.0.0.1 → 127.0.0.1    TCP 40 [TCP Dup ACK 24#1] 52533 → 9090 [ACK] Seq=13 Ack=160 Win=10002 Len=0
   26   0.720578    127.0.0.1 → 127.0.0.1    TCP 195 9090 → 52533 [PSH, ACK] Seq=160 Ack=13 Win=10214 Len=155
   27   0.720578    127.0.0.1 → 127.0.0.1    TCP 195 [TCP Retransmission] 9090 → 52533 [PSH, ACK] Seq=160 Ack=13 Win=10214 Len=155
   28   0.720578    127.0.0.1 → 127.0.0.1    TCP 40 52533 → 9090 [ACK] Seq=13 Ack=315 Win=10001 Len=0
   29   0.720578    127.0.0.1 → 127.0.0.1    TCP 40 [TCP Dup ACK 28#1] 52533 → 9090 [ACK] Seq=13 Ack=315 Win=10001 Len=0
   30   0.792841  192.168.1.1 → 239.255.255.250 SSDP 428 NOTIFY * HTTP/1.1 
   31   0.793804  192.168.1.1 → 239.255.255.250 SSDP 500 NOTIFY * HTTP/1.1 
   32   0.794778  192.168.1.1 → 239.255.255.250 SSDP 437 NOTIFY * HTTP/1.1 
   33   0.794778  192.168.1.1 → 239.255.255.250 SSDP 496 NOTIFY * HTTP/1.1 
   34   0.795753  192.168.1.1 → 239.255.255.250 SSDP 437 NOTIFY * HTTP/1.1 
   35   0.796746  192.168.1.1 → 239.255.255.250 SSDP 476 NOTIFY * HTTP/1.1 
   36   0.797721  192.168.1.1 → 239.255.255.250 SSDP 437 NOTIFY * HTTP/1.1 
   37   0.799689  192.168.1.1 → 239.255.255.250 SSDP 490 NOTIFY * HTTP/1.1 
   38   0.800665  192.168.1.1 → 239.255.255.250 SSDP 508 NOTIFY * HTTP/1.1 
   39   0.801641  192.168.1.1 → 239.255.255.250 SSDP 492 NOTIFY * HTTP/1.1 
   40   0.981260  106.2.59.95 → 192.168.1.59 TCP 97 31643 → 52729 [PSH, ACK] Seq=1 Ack=1 Win=82 Len=57
   41   1.001761  192.168.1.1 → 239.255.255.250 SSDP 492 NOTIFY * HTTP/1.1 
   42   1.003727  192.168.1.1 → 239.255.255.250 SSDP 508 NOTIFY * HTTP/1.1 
   43   1.004689  192.168.1.1 → 239.255.255.250 SSDP 490 NOTIFY * HTTP/1.1 
   44   1.005665  192.168.1.1 → 239.255.255.250 SSDP 437 NOTIFY * HTTP/1.1 
   45   1.006642  192.168.1.1 → 239.255.255.250 SSDP 476 NOTIFY * HTTP/1.1 
   46   1.007623  192.168.1.1 → 239.255.255.250 SSDP 437 NOTIFY * HTTP/1.1 
   47   1.008594  192.168.1.1 → 239.255.255.250 SSDP 496 NOTIFY * HTTP/1.1 
   48   1.009571  192.168.1.1 → 239.255.255.250 SSDP 437 NOTIFY * HTTP/1.1 
   49   1.010548  192.168.1.1 → 239.255.255.250 SSDP 500 NOTIFY * HTTP/1.1 
   50   1.011540  192.168.1.1 → 239.255.255.250 SSDP 428 NOTIFY * HTTP/1.1 
   51   1.021286 192.168.1.59 → 106.2.59.95  TCP 40 52729 → 31643 [ACK] Seq=1 Ack=58 Win=510 Len=0
   52   1.103029 192.168.1.142 → 239.255.255.250 SSDP 202 M-SEARCH * HTTP/1.1 
   53   1.424290    127.0.0.1 → 127.0.0.1    TCP 42 52533 → 9090 [PSH, ACK] Seq=13 Ack=315 Win=10001 Len=2
   54   1.424290    127.0.0.1 → 127.0.0.1    TCP 42 [TCP Retransmission] 52533 → 9090 [PSH, ACK] Seq=13 Ack=315 Win=10001 Len=2
   55   1.424290    127.0.0.1 → 127.0.0.1    TCP 40 9090 → 52533 [ACK] Seq=315 Ack=15 Win=10214 Len=0
   56   1.424290    127.0.0.1 → 127.0.0.1    TCP 40 [TCP Dup ACK 55#1] 9090 → 52533 [ACK] Seq=315 Ack=15 Win=10214 Len=0
   57   1.424290    127.0.0.1 → 127.0.0.1    TCP 42 9090 → 52533 [PSH, ACK] Seq=315 Ack=15 Win=10214 Len=2
   58   1.424290    127.0.0.1 → 127.0.0.1    TCP 44 52533 → 9090 [PSH, ACK] Seq=15 Ack=315 Win=10001 Len=4
   59   1.424290    127.0.0.1 → 127.0.0.1    TCP 44 [TCP Retransmission] 52533 → 9090 [PSH, ACK] Seq=15 Ack=315 Win=10001 Len=4
   60   1.424290    127.0.0.1 → 127.0.0.1    TCP 40 9090 → 52533 [ACK] Seq=317 Ack=19 Win=10214 Len=0
   61   1.424290    127.0.0.1 → 127.0.0.1    TCP 42 [TCP Retransmission] 9090 → 52533 [PSH, ACK] Seq=315 Ack=15 Win=10214 Len=2
   62   1.424290    127.0.0.1 → 127.0.0.1    TCP 40 9090 → 52533 [ACK] Seq=317 Ack=19 Win=10214 Len=0
   63   1.424290    127.0.0.1 → 127.0.0.1    TCP 40 52533 → 9090 [ACK] Seq=19 Ack=317 Win=10001 Len=0
   64   1.424290    127.0.0.1 → 127.0.0.1    TCP 40 [TCP Dup ACK 63#1] 52533 → 9090 [ACK] Seq=19 Ack=317 Win=10001 Len=0
   65   1.424290    127.0.0.1 → 127.0.0.1    TCP 42 52533 → 9090 [PSH, ACK] Seq=19 Ack=317 Win=10001 Len=2
   66   1.425267    127.0.0.1 → 127.0.0.1    TCP 42 [TCP Retransmission] 52533 → 9090 [PSH, ACK] Seq=19 Ack=317 Win=10001 Len=2
   67   1.425267    127.0.0.1 → 127.0.0.1    TCP 40 9090 → 52533 [ACK] Seq=317 Ack=21 Win=10214 Len=0
   68   1.425267    127.0.0.1 → 127.0.0.1    TCP 40 [TCP Dup ACK 67#1] 9090 → 52533 [ACK] Seq=317 Ack=21 Win=10214 Len=0
   69   1.425267    127.0.0.1 → 127.0.0.1    TCP 44 52533 → 9090 [PSH, ACK] Seq=21 Ack=317 Win=10001 Len=4
   70   1.425267    127.0.0.1 → 127.0.0.1    TCP 44 [TCP Retransmission] 52533 → 9090 [PSH, ACK] Seq=21 Ack=317 Win=10001 Len=4
   71   1.425267    127.0.0.1 → 127.0.0.1    TCP 40 9090 → 52533 [ACK] Seq=317 Ack=25 Win=10214 Len=0
   72   1.425267    127.0.0.1 → 127.0.0.1    TCP 40 [TCP Dup ACK 71#1] 9090 → 52533 [ACK] Seq=317 Ack=25 Win=10214 Len=0
   73   1.425267    127.0.0.1 → 127.0.0.1    TCP 195 9090 → 52533 [PSH, ACK] Seq=317 Ack=25 Win=10214 Len=155
   74   1.425267    127.0.0.1 → 127.0.0.1    TCP 195 [TCP Retransmission] 9090 → 52533 [PSH, ACK] Seq=317 Ack=25 Win=10214 Len=155
   75   1.425267    127.0.0.1 → 127.0.0.1    TCP 40 52533 → 9090 [ACK] Seq=25 Ack=472 Win=10001 Len=0
   76   1.425267    127.0.0.1 → 127.0.0.1    TCP 40 [TCP Dup ACK 75#1] 52533 → 9090 [ACK] Seq=25 Ack=472 Win=10001 Len=0
   77   1.447724 192.168.1.59 → 58.144.251.2 UDP 81 10632 → 8000 Len=53
   78   1.459113 58.144.251.2 → 192.168.1.59 UDP 53 8000 → 10632 Len=25
   79   1.685678  106.2.59.95 → 192.168.1.59 TCP 280 31643 → 52729 [PSH, ACK] Seq=58 Ack=1 Win=82 Len=240
   80   1.726658    127.0.0.1 → 127.0.0.1    TCP 42 9090 → 52533 [PSH, ACK] Seq=472 Ack=25 Win=10214 Len=2
   81   1.726658    127.0.0.1 → 127.0.0.1    TCP 42 [TCP Retransmission] 9090 → 52533 [PSH, ACK] Seq=472 Ack=25 Win=10214 Len=2
   82   1.726658    127.0.0.1 → 127.0.0.1    TCP 40 52533 → 9090 [ACK] Seq=25 Ack=474 Win=10001 Len=0
   83   1.726658    127.0.0.1 → 127.0.0.1    TCP 40 [TCP Dup ACK 82#1] 52533 → 9090 [ACK] Seq=25 Ack=474 Win=10001 Len=0
   84   1.726658    127.0.0.1 → 127.0.0.1    TCP 195 9090 → 52533 [PSH, ACK] Seq=474 Ack=25 Win=10214 Len=155
   85   1.726658    127.0.0.1 → 127.0.0.1    TCP 195 [TCP Retransmission] 9090 → 52533 [PSH, ACK] Seq=474 Ack=25 Win=10214 Len=155
   86   1.726658    127.0.0.1 → 127.0.0.1    TCP 40 52533 → 9090 [ACK] Seq=25 Ack=629 Win=10000 Len=0
   87   1.726658    127.0.0.1 → 127.0.0.1    TCP 40 [TCP Dup ACK 86#1] 52533 → 9090 [ACK] Seq=25 Ack=629 Win=10000 Len=0
   88   1.726658 192.168.1.59 → 106.2.59.95  TCP 40 52729 → 31643 [ACK] Seq=1 Ack=298 Win=509 Len=0
   89   1.790101 192.168.1.59 → 106.2.59.95  TCP 65 52729 → 31643 [PSH, ACK] Seq=1 Ack=298 Win=509 Len=25
   90   1.853562  106.2.59.95 → 192.168.1.59 TCP 40 31643 → 52729 [ACK] Seq=298 Ack=26 Win=82 Len=0
   91   1.889695  106.2.59.95 → 192.168.1.59 TCP 93 31643 → 52729 [PSH, ACK] Seq=298 Ack=26 Win=82 Len=53
   92   1.930745 192.168.1.59 → 106.2.59.95  TCP 40 52729 → 31643 [ACK] Seq=26 Ack=351 Win=508 Len=0
   93   2.006847 192.168.1.59 → 255.255.255.255 UDP 125 50442 → 10505 Len=97
   94   2.431550    127.0.0.1 → 127.0.0.1    TCP 42 52533 → 9090 [PSH, ACK] Seq=25 Ack=629 Win=10000 Len=2
   95   2.431550    127.0.0.1 → 127.0.0.1    TCP 42 [TCP Retransmission] 52533 → 9090 [PSH, ACK] Seq=25 Ack=629 Win=10000 Len=2
   96   2.431550    127.0.0.1 → 127.0.0.1    TCP 40 9090 → 52533 [ACK] Seq=629 Ack=27 Win=10214 Len=0
   97   2.431550    127.0.0.1 → 127.0.0.1    TCP 40 [TCP Dup ACK 96#1] 9090 → 52533 [ACK] Seq=629 Ack=27 Win=10214 Len=0
   98   2.431550    127.0.0.1 → 127.0.0.1    TCP 42 9090 → 52533 [PSH, ACK] Seq=629 Ack=27 Win=10214 Len=2
   99   2.431550    127.0.0.1 → 127.0.0.1    TCP 44 52533 → 9090 [PSH, ACK] Seq=27 Ack=629 Win=10000 Len=4
  100   2.431550    127.0.0.1 → 127.0.0.1    TCP 42 [TCP Retransmission] 9090 → 52533 [PSH, ACK] Seq=629 Ack=27 Win=10214 Len=2
  101   2.431550    127.0.0.1 → 127.0.0.1    TCP 42 52533 → 9090 [PSH, ACK] Seq=31 Ack=631 Win=10000 Len=2
  102   2.431550    127.0.0.1 → 127.0.0.1    TCP 44 [TCP Out-Of-Order] 52533 → 9090 [PSH, ACK] Seq=27 Ack=629 Win=10000 Len=4
  103   2.431550    127.0.0.1 → 127.0.0.1    TCP 42 [TCP Retransmission] 52533 → 9090 [PSH, ACK] Seq=31 Ack=631 Win=10000 Len=2
  104   2.431550    127.0.0.1 → 127.0.0.1    TCP 40 9090 → 52533 [ACK] Seq=631 Ack=33 Win=10214 Len=0
  105   2.431550    127.0.0.1 → 127.0.0.1    TCP 40 [TCP Dup ACK 104#1] 9090 → 52533 [ACK] Seq=631 Ack=33 Win=10214 Len=0
  106   2.431550    127.0.0.1 → 127.0.0.1    TCP 44 52533 → 9090 [PSH, ACK] Seq=33 Ack=631 Win=10000 Len=4
  107   2.431550    127.0.0.1 → 127.0.0.1    TCP 44 [TCP Retransmission] 52533 → 9090 [PSH, ACK] Seq=33 Ack=631 Win=10000 Len=4
  108   2.431550    127.0.0.1 → 127.0.0.1    TCP 40 9090 → 52533 [ACK] Seq=631 Ack=37 Win=10214 Len=0
  109   2.431550    127.0.0.1 → 127.0.0.1    TCP 40 [TCP Dup ACK 108#1] 9090 → 52533 [ACK] Seq=631 Ack=37 Win=10214 Len=0
  110   2.431550    127.0.0.1 → 127.0.0.1    TCP 195 9090 → 52533 [PSH, ACK] Seq=631 Ack=37 Win=10214 Len=155
  111   2.431550    127.0.0.1 → 127.0.0.1    TCP 195 [TCP Retransmission] 9090 → 52533 [PSH, ACK] Seq=631 Ack=37 Win=10214 Len=155
  112   2.431550    127.0.0.1 → 127.0.0.1    TCP 40 52533 → 9090 [ACK] Seq=37 Ack=786 Win=9999 Len=0
  113   2.431550    127.0.0.1 → 127.0.0.1    TCP 40 [TCP Dup ACK 112#1] 52533 → 9090 [ACK] Seq=37 Ack=786 Win=9999 Len=0
  114   2.593656  106.2.59.95 → 192.168.1.59 TCP 76 31643 → 52729 [PSH, ACK] Seq=351 Ack=26 Win=82 Len=36
  115   2.635640 192.168.1.59 → 106.2.59.95  TCP 40 52729 → 31643 [ACK] Seq=26 Ack=387 Win=508 Len=0
  116   2.694265  106.2.59.95 → 192.168.1.59 TCP 247 31643 → 52729 [PSH, ACK] Seq=387 Ack=26 Win=82 Len=207
  117   2.734295 192.168.1.59 → 106.2.59.95  TCP 40 52729 → 31643 [ACK] Seq=26 Ack=594 Win=507 Len=0
  118   2.734295    127.0.0.1 → 127.0.0.1    TCP 42 9090 → 52533 [PSH, ACK] Seq=786 Ack=37 Win=10214 Len=2
  119   2.734295    127.0.0.1 → 127.0.0.1    TCP 42 [TCP Retransmission] 9090 → 52533 [PSH, ACK] Seq=786 Ack=37 Win=10214 Len=2
  120   2.734295    127.0.0.1 → 127.0.0.1    TCP 40 52533 → 9090 [ACK] Seq=37 Ack=788 Win=9999 Len=0
  121   2.734295    127.0.0.1 → 127.0.0.1    TCP 40 [TCP Dup ACK 120#1] 52533 → 9090 [ACK] Seq=37 Ack=788 Win=9999 Len=0
  122   2.734295    127.0.0.1 → 127.0.0.1    TCP 195 9090 → 52533 [PSH, ACK] Seq=788 Ack=37 Win=10214 Len=155
  123   2.734295    127.0.0.1 → 127.0.0.1    TCP 195 [TCP Retransmission] 9090 → 52533 [PSH, ACK] Seq=788 Ack=37 Win=10214 Len=155
  124   2.734295    127.0.0.1 → 127.0.0.1    TCP 40 52533 → 9090 [ACK] Seq=37 Ack=943 Win=9999 Len=0
  125   2.734295    127.0.0.1 → 127.0.0.1    TCP 40 [TCP Dup ACK 124#1] 52533 → 9090 [ACK] Seq=37 Ack=943 Win=9999 Len=0
  126   3.068648 192.168.1.142 → 239.255.255.250 SSDP 202 M-SEARCH * HTTP/1.1 
  127   3.304776  106.2.59.95 → 192.168.1.59 TCP 109 31643 → 52729 [PSH, ACK] Seq=594 Ack=26 Win=82 Len=69
  128   3.345784 192.168.1.59 → 106.2.59.95  TCP 40 52729 → 31643 [ACK] Seq=26 Ack=663 Win=507 Len=0
  129   3.438365    127.0.0.1 → 127.0.0.1    TCP 42 52533 → 9090 [PSH, ACK] Seq=37 Ack=943 Win=9999 Len=2
  130   3.438365    127.0.0.1 → 127.0.0.1    TCP 42 [TCP Retransmission] 52533 → 9090 [PSH, ACK] Seq=37 Ack=943 Win=9999 Len=2
  131   3.438365    127.0.0.1 → 127.0.0.1    TCP 40 9090 → 52533 [ACK] Seq=943 Ack=39 Win=10214 Len=0
  132   3.438365    127.0.0.1 → 127.0.0.1    TCP 40 [TCP Dup ACK 131#1] 9090 → 52533 [ACK] Seq=943 Ack=39 Win=10214 Len=0
  133   3.438365    127.0.0.1 → 127.0.0.1    TCP 42 9090 → 52533 [PSH, ACK] Seq=943 Ack=39 Win=10214 Len=2
  134   3.438365    127.0.0.1 → 127.0.0.1    TCP 44 52533 → 9090 [PSH, ACK] Seq=39 Ack=943 Win=9999 Len=4
  135   3.438365    127.0.0.1 → 127.0.0.1    TCP 42 [TCP Retransmission] 9090 → 52533 [PSH, ACK] Seq=943 Ack=39 Win=10214 Len=2
  136   3.438365    127.0.0.1 → 127.0.0.1    TCP 46 52533 → 9090 [PSH, ACK] Seq=43 Ack=945 Win=9999 Len=6
  137   3.438365    127.0.0.1 → 127.0.0.1    TCP 44 [TCP Out-Of-Order] 52533 → 9090 [PSH, ACK] Seq=39 Ack=943 Win=9999 Len=4
  138   3.438365    127.0.0.1 → 127.0.0.1    TCP 46 [TCP Retransmission] 52533 → 9090 [PSH, ACK] Seq=43 Ack=945 Win=9999 Len=6
  139   3.438365    127.0.0.1 → 127.0.0.1    TCP 40 9090 → 52533 [ACK] Seq=945 Ack=49 Win=10214 Len=0
  140   3.438365    127.0.0.1 → 127.0.0.1    TCP 40 [TCP Dup ACK 139#1] 9090 → 52533 [ACK] Seq=945 Ack=49 Win=10214 Len=0
  141   3.439359    127.0.0.1 → 127.0.0.1    TCP 195 9090 → 52533 [PSH, ACK] Seq=945 Ack=49 Win=10214 Len=155
  142   3.439359    127.0.0.1 → 127.0.0.1    TCP 195 [TCP Retransmission] 9090 → 52533 [PSH, ACK] Seq=945 Ack=49 Win=10214 Len=155
  143   3.439359    127.0.0.1 → 127.0.0.1    TCP 40 52533 → 9090 [ACK] Seq=49 Ack=1100 Win=9998 Len=0
  144   3.439359    127.0.0.1 → 127.0.0.1    TCP 40 [TCP Dup ACK 143#1] 52533 → 9090 [ACK] Seq=49 Ack=1100 Win=9998 Len=0
  145   3.550658 192.168.1.59 → 203.208.40.41 TCP 41 [TCP segment of a reassembled PDU]
  146   3.607323 203.208.40.41 → 192.168.1.59 TCP 52 443 → 52356 [ACK] Seq=1 Ack=2 Win=256 Len=0 SLE=1 SRE=2
  147   3.741117    127.0.0.1 → 127.0.0.1    TCP 42 9090 → 52533 [PSH, ACK] Seq=1100 Ack=49 Win=10214 Len=2
  148   3.741117    127.0.0.1 → 127.0.0.1    TCP 42 [TCP Retransmission] 9090 → 52533 [PSH, ACK] Seq=1100 Ack=49 Win=10214 Len=2
  149   3.741117    127.0.0.1 → 127.0.0.1    TCP 40 52533 → 9090 [ACK] Seq=49 Ack=1102 Win=9998 Len=0
  150   3.741117    127.0.0.1 → 127.0.0.1    TCP 40 [TCP Dup ACK 149#1] 52533 → 9090 [ACK] Seq=49 Ack=1102 Win=9998 Len=0
  151   3.745945    127.0.0.1 → 127.0.0.1    TCP 195 9090 → 52533 [PSH, ACK] Seq=1102 Ack=49 Win=10214 Len=155
  152   3.745945    127.0.0.1 → 127.0.0.1    TCP 195 [TCP Retransmission] 9090 → 52533 [PSH, ACK] Seq=1102 Ack=49 Win=10214 Len=155
  153   3.745945    127.0.0.1 → 127.0.0.1    TCP 40 52533 → 9090 [ACK] Seq=49 Ack=1257 Win=9998 Len=0
  154   3.745945    127.0.0.1 → 127.0.0.1    TCP 40 [TCP Dup ACK 153#1] 52533 → 9090 [ACK] Seq=49 Ack=1257 Win=9998 Len=0
  155   3.995885  106.2.59.95 → 192.168.1.59 TCP 82 31643 → 52729 [PSH, ACK] Seq=663 Ack=26 Win=82 Len=42
  156   4.014437 192.168.1.59 → 255.255.255.255 UDP 125 50443 → 10505 Len=97
  157   4.036910 192.168.1.59 → 106.2.59.95  TCP 40 52729 → 31643 [ACK] Seq=26 Ack=705 Win=513 Len=0
  158   4.070087 192.168.1.142 → 239.255.255.250 SSDP 202 M-SEARCH * HTTP/1.1 
  159   4.073018 192.168.1.59 → 182.254.110.90 OICQ 67 OICQ Protocol 
  160   4.179479 182.254.110.90 → 192.168.1.59 OICQ 75 OICQ Protocol 
  161   4.212709  106.2.59.95 → 192.168.1.59 TCP 121 31643 → 52729 [PSH, ACK] Seq=705 Ack=26 Win=82 Len=81
  162   4.253679 192.168.1.59 → 106.2.59.95  TCP 40 52729 → 31643 [ACK] Seq=26 Ack=786 Win=512 Len=0
  163   4.324060  106.2.59.95 → 192.168.1.59 TCP 142 31643 → 52729 [PSH, ACK] Seq=786 Ack=26 Win=82 Len=102
  164   4.366043 192.168.1.59 → 106.2.59.95  TCP 40 52729 → 31643 [ACK] Seq=26 Ack=888 Win=512 Len=0
  165   4.421703  106.2.59.95 → 192.168.1.59 TCP 152 31643 → 52729 [PSH, ACK] Seq=888 Ack=26 Win=82 Len=112
  166   4.443190    127.0.0.1 → 127.0.0.1    TCP 42 52533 → 9090 [PSH, ACK] Seq=49 Ack=1257 Win=9998 Len=2
  167   4.443190    127.0.0.1 → 127.0.0.1    TCP 42 [TCP Retransmission] 52533 → 9090 [PSH, ACK] Seq=49 Ack=1257 Win=9998 Len=2
  168   4.443190    127.0.0.1 → 127.0.0.1    TCP 40 9090 → 52533 [ACK] Seq=1257 Ack=51 Win=10214 Len=0
  169   4.443190    127.0.0.1 → 127.0.0.1    TCP 40 [TCP Dup ACK 168#1] 9090 → 52533 [ACK] Seq=1257 Ack=51 Win=10214 Len=0
  170   4.443190    127.0.0.1 → 127.0.0.1    TCP 42 9090 → 52533 [PSH, ACK] Seq=1257 Ack=51 Win=10214 Len=2
  171   4.443190    127.0.0.1 → 127.0.0.1    TCP 44 52533 → 9090 [PSH, ACK] Seq=51 Ack=1257 Win=9998 Len=4
  172   4.443190    127.0.0.1 → 127.0.0.1    TCP 42 [TCP Retransmission] 9090 → 52533 [PSH, ACK] Seq=1257 Ack=51 Win=10214 Len=2
  173   4.443190    127.0.0.1 → 127.0.0.1    TCP 40 52533 → 9090 [ACK] Seq=55 Ack=1259 Win=9998 Len=0
  174   4.443190    127.0.0.1 → 127.0.0.1    TCP 44 [TCP Retransmission] 52533 → 9090 [PSH, ACK] Seq=51 Ack=1257 Win=9998 Len=4
  175   4.443190    127.0.0.1 → 127.0.0.1    TCP 40 52533 → 9090 [ACK] Seq=55 Ack=1259 Win=9998 Len=0
  176   4.443190    127.0.0.1 → 127.0.0.1    TCP 40 9090 → 52533 [ACK] Seq=1259 Ack=55 Win=10214 Len=0
  177   4.443190    127.0.0.1 → 127.0.0.1    TCP 40 [TCP Dup ACK 176#1] 9090 → 52533 [ACK] Seq=1259 Ack=55 Win=10214 Len=0
  178   4.443190    127.0.0.1 → 127.0.0.1    TCP 46 52533 → 9090 [PSH, ACK] Seq=55 Ack=1259 Win=9998 Len=6
  179   4.443190    127.0.0.1 → 127.0.0.1    TCP 46 [TCP Retransmission] 52533 → 9090 [PSH, ACK] Seq=55 Ack=1259 Win=9998 Len=6
  180   4.443190    127.0.0.1 → 127.0.0.1    TCP 40 9090 → 52533 [ACK] Seq=1259 Ack=61 Win=10214 Len=0
  181   4.444146    127.0.0.1 → 127.0.0.1    TCP 40 [TCP Dup ACK 180#1] 9090 → 52533 [ACK] Seq=1259 Ack=61 Win=10214 Len=0
  182   4.444146    127.0.0.1 → 127.0.0.1    TCP 195 9090 → 52533 [PSH, ACK] Seq=1259 Ack=61 Win=10214 Len=155
  183   4.444146    127.0.0.1 → 127.0.0.1    TCP 195 [TCP Retransmission] 9090 → 52533 [PSH, ACK] Seq=1259 Ack=61 Win=10214 Len=155
  184   4.444146    127.0.0.1 → 127.0.0.1    TCP 40 52533 → 9090 [ACK] Seq=61 Ack=1414 Win=9997 Len=0
  185   4.444146    127.0.0.1 → 127.0.0.1    TCP 40 [TCP Dup ACK 184#1] 52533 → 9090 [ACK] Seq=61 Ack=1414 Win=9997 Len=0
  186   4.464651 192.168.1.59 → 106.2.59.95  TCP 40 52729 → 31643 [ACK] Seq=26 Ack=1000 Win=512 Len=0
  187   4.699964  106.2.59.95 → 192.168.1.59 TCP 145 31643 → 52729 [PSH, ACK] Seq=1000 Ack=26 Win=82 Len=105
  188   4.740952 192.168.1.59 → 106.2.59.95  TCP 40 52729 → 31643 [ACK] Seq=26 Ack=1105 Win=511 Len=0
  189   4.745834    127.0.0.1 → 127.0.0.1    TCP 42 9090 → 52533 [PSH, ACK] Seq=1414 Ack=61 Win=10214 Len=2
  190   4.745834    127.0.0.1 → 127.0.0.1    TCP 42 [TCP Retransmission] 9090 → 52533 [PSH, ACK] Seq=1414 Ack=61 Win=10214 Len=2
  191   4.745834    127.0.0.1 → 127.0.0.1    TCP 40 52533 → 9090 [ACK] Seq=61 Ack=1416 Win=9997 Len=0
  192   4.745834    127.0.0.1 → 127.0.0.1    TCP 40 [TCP Dup ACK 191#1] 52533 → 9090 [ACK] Seq=61 Ack=1416 Win=9997 Len=0
  193   4.745834    127.0.0.1 → 127.0.0.1    TCP 195 9090 → 52533 [PSH, ACK] Seq=1416 Ack=61 Win=10214 Len=155
  194   4.745834    127.0.0.1 → 127.0.0.1    TCP 195 [TCP Retransmission] 9090 → 52533 [PSH, ACK] Seq=1416 Ack=61 Win=10214 Len=155
  195   4.745834    127.0.0.1 → 127.0.0.1    TCP 40 52533 → 9090 [ACK] Seq=61 Ack=1571 Win=9996 Len=0
  196   4.745834    127.0.0.1 → 127.0.0.1    TCP 40 [TCP Dup ACK 195#1] 52533 → 9090 [ACK] Seq=61 Ack=1571 Win=9996 Len=0
  197   5.454757    127.0.0.1 → 127.0.0.1    TCP 42 52533 → 9090 [PSH, ACK] Seq=61 Ack=1571 Win=9996 Len=2
  198   5.454757    127.0.0.1 → 127.0.0.1    TCP 42 [TCP Retransmission] 52533 → 9090 [PSH, ACK] Seq=61 Ack=1571 Win=9996 Len=2
  199   5.454757    127.0.0.1 → 127.0.0.1    TCP 40 9090 → 52533 [ACK] Seq=1571 Ack=63 Win=10214 Len=0
  200   5.454757    127.0.0.1 → 127.0.0.1    TCP 40 [TCP Dup ACK 199#1] 9090 → 52533 [ACK] Seq=1571 Ack=63 Win=10214 Len=0
  201   5.454757    127.0.0.1 → 127.0.0.1    TCP 42 9090 → 52533 [PSH, ACK] Seq=1571 Ack=63 Win=10214 Len=2
  202   5.454757    127.0.0.1 → 127.0.0.1    TCP 44 52533 → 9090 [PSH, ACK] Seq=63 Ack=1571 Win=9996 Len=4
  203   5.454757    127.0.0.1 → 127.0.0.1    TCP 42 [TCP Retransmission] 9090 → 52533 [PSH, ACK] Seq=1571 Ack=63 Win=10214 Len=2
  204   5.454757    127.0.0.1 → 127.0.0.1    TCP 40 52533 → 9090 [ACK] Seq=67 Ack=1573 Win=9996 Len=0
  205   5.454757    127.0.0.1 → 127.0.0.1    TCP 44 [TCP Retransmission] 52533 → 9090 [PSH, ACK] Seq=63 Ack=1571 Win=9996 Len=4
  206   5.454757    127.0.0.1 → 127.0.0.1    TCP 40 52533 → 9090 [ACK] Seq=67 Ack=1573 Win=9996 Len=0
  207   5.454757    127.0.0.1 → 127.0.0.1    TCP 40 9090 → 52533 [ACK] Seq=1573 Ack=67 Win=10214 Len=0
  208   5.454757    127.0.0.1 → 127.0.0.1    TCP 40 [TCP Dup ACK 207#1] 9090 → 52533 [ACK] Seq=1573 Ack=67 Win=10214 Len=0
  209   5.454757    127.0.0.1 → 127.0.0.1    TCP 46 52533 → 9090 [PSH, ACK] Seq=67 Ack=1573 Win=9996 Len=6
  210   5.454757    127.0.0.1 → 127.0.0.1    TCP 46 [TCP Retransmission] 52533 → 9090 [PSH, ACK] Seq=67 Ack=1573 Win=9996 Len=6
  211   5.454757    127.0.0.1 → 127.0.0.1    TCP 40 9090 → 52533 [ACK] Seq=1573 Ack=73 Win=10214 Len=0
  212   5.454757    127.0.0.1 → 127.0.0.1    TCP 40 [TCP Dup ACK 211#1] 9090 → 52533 [ACK] Seq=1573 Ack=73 Win=10214 Len=0
  213   5.454757    127.0.0.1 → 127.0.0.1    TCP 195 9090 → 52533 [PSH, ACK] Seq=1573 Ack=73 Win=10214 Len=155
  214   5.454757    127.0.0.1 → 127.0.0.1    TCP 195 [TCP Retransmission] 9090 → 52533 [PSH, ACK] Seq=1573 Ack=73 Win=10214 Len=155
  215   5.454757    127.0.0.1 → 127.0.0.1    TCP 40 52533 → 9090 [ACK] Seq=73 Ack=1728 Win=9996 Len=0
  216   5.454757    127.0.0.1 → 127.0.0.1    TCP 40 [TCP Dup ACK 215#1] 52533 → 9090 [ACK] Seq=73 Ack=1728 Win=9996 Len=0
  217   5.757134    127.0.0.1 → 127.0.0.1    TCP 42 9090 → 52533 [PSH, ACK] Seq=1728 Ack=73 Win=10214 Len=2
  218   5.757134    127.0.0.1 → 127.0.0.1    TCP 42 [TCP Retransmission] 9090 → 52533 [PSH, ACK] Seq=1728 Ack=73 Win=10214 Len=2
  219   5.757134    127.0.0.1 → 127.0.0.1    TCP 40 52533 → 9090 [ACK] Seq=73 Ack=1730 Win=9996 Len=0
  220   5.757134    127.0.0.1 → 127.0.0.1    TCP 40 [TCP Dup ACK 219#1] 52533 → 9090 [ACK] Seq=73 Ack=1730 Win=9996 Len=0
  221   5.757134    127.0.0.1 → 127.0.0.1    TCP 195 9090 → 52533 [PSH, ACK] Seq=1730 Ack=73 Win=10214 Len=155
  222   5.757134    127.0.0.1 → 127.0.0.1    TCP 195 [TCP Retransmission] 9090 → 52533 [PSH, ACK] Seq=1730 Ack=73 Win=10214 Len=155
  223   5.757134    127.0.0.1 → 127.0.0.1    TCP 40 52533 → 9090 [ACK] Seq=73 Ack=1885 Win=9995 Len=0
  224   5.757134    127.0.0.1 → 127.0.0.1    TCP 40 [TCP Dup ACK 223#1] 52533 → 9090 [ACK] Seq=73 Ack=1885 Win=9995 Len=0
  225   6.020745 192.168.1.59 → 255.255.255.255 UDP 125 50444 → 10505 Len=97
  226   6.099827  106.2.59.95 → 192.168.1.59 TCP 94 31643 → 52729 [PSH, ACK] Seq=1105 Ack=26 Win=82 Len=54
  227   6.140833 192.168.1.59 → 106.2.59.95  TCP 40 52729 → 31643 [ACK] Seq=26 Ack=1159 Win=511 Len=0
  228   6.306864  106.2.59.95 → 192.168.1.59 TCP 92 31643 → 52729 [PSH, ACK] Seq=1159 Ack=26 Win=82 Len=52
  229   6.346865 192.168.1.59 → 106.2.59.95  TCP 40 52729 → 31643 [ACK] Seq=26 Ack=1211 Win=511 Len=0
  230   6.461115    127.0.0.1 → 127.0.0.1    TCP 42 52533 → 9090 [PSH, ACK] Seq=73 Ack=1885 Win=9995 Len=2
  231   6.461115    127.0.0.1 → 127.0.0.1    TCP 42 [TCP Retransmission] 52533 → 9090 [PSH, ACK] Seq=73 Ack=1885 Win=9995 Len=2
  232   6.461115    127.0.0.1 → 127.0.0.1    TCP 40 9090 → 52533 [ACK] Seq=1885 Ack=75 Win=10214 Len=0
  233   6.461115    127.0.0.1 → 127.0.0.1    TCP 40 [TCP Dup ACK 232#1] 9090 → 52533 [ACK] Seq=1885 Ack=75 Win=10214 Len=0
  234   6.461115    127.0.0.1 → 127.0.0.1    TCP 42 9090 → 52533 [PSH, ACK] Seq=1885 Ack=75 Win=10214 Len=2
  235   6.461115    127.0.0.1 → 127.0.0.1    TCP 42 [TCP Retransmission] 9090 → 52533 [PSH, ACK] Seq=1885 Ack=75 Win=10214 Len=2
  236   6.461115    127.0.0.1 → 127.0.0.1    TCP 44 52533 → 9090 [PSH, ACK] Seq=75 Ack=1887 Win=9995 Len=4
  237   6.461115    127.0.0.1 → 127.0.0.1    TCP 44 [TCP Retransmission] 52533 → 9090 [PSH, ACK] Seq=75 Ack=1887 Win=9995 Len=4
  238   6.461115    127.0.0.1 → 127.0.0.1    TCP 40 9090 → 52533 [ACK] Seq=1887 Ack=79 Win=10214 Len=0
  239   6.461115    127.0.0.1 → 127.0.0.1    TCP 40 [TCP Dup ACK 238#1] 9090 → 52533 [ACK] Seq=1887 Ack=79 Win=10214 Len=0
  240   6.461115    127.0.0.1 → 127.0.0.1    TCP 46 52533 → 9090 [PSH, ACK] Seq=79 Ack=1887 Win=9995 Len=6
  241   6.461115    127.0.0.1 → 127.0.0.1    TCP 46 [TCP Retransmission] 52533 → 9090 [PSH, ACK] Seq=79 Ack=1887 Win=9995 Len=6
  242   6.461115    127.0.0.1 → 127.0.0.1    TCP 40 9090 → 52533 [ACK] Seq=1887 Ack=85 Win=10214 Len=0
  243   6.461115    127.0.0.1 → 127.0.0.1    TCP 40 [TCP Dup ACK 242#1] 9090 → 52533 [ACK] Seq=1887 Ack=85 Win=10214 Len=0
  244   6.461115    127.0.0.1 → 127.0.0.1    TCP 195 9090 → 52533 [PSH, ACK] Seq=1887 Ack=85 Win=10214 Len=155
  245   6.461115    127.0.0.1 → 127.0.0.1    TCP 195 [TCP Retransmission] 9090 → 52533 [PSH, ACK] Seq=1887 Ack=85 Win=10214 Len=155
  246   6.461115    127.0.0.1 → 127.0.0.1    TCP 40 52533 → 9090 [ACK] Seq=85 Ack=2042 Win=9995 Len=0
  247   6.461115    127.0.0.1 → 127.0.0.1    TCP 40 [TCP Dup ACK 246#1] 52533 → 9090 [ACK] Seq=85 Ack=2042 Win=9995 Len=0
  248   6.505083  106.2.59.95 → 192.168.1.59 TCP 97 31643 → 52729 [PSH, ACK] Seq=1211 Ack=26 Win=82 Len=57
  249   6.546076 192.168.1.59 → 106.2.59.95  TCP 40 52729 → 31643 [ACK] Seq=26 Ack=1268 Win=511 Len=0
  250   6.629130 192.168.1.30 → 224.0.0.251  MDNS 67 Standard query 0x0000 A BRWA86BAD339915.local, "QM" question
  251   6.631082 fe80::1020:985e:ac68:7850 → ff02::fb     MDNS 87 Standard query 0x0000 A BRWA86BAD339915.local, "QM" question
  252   6.703369  106.2.59.95 → 192.168.1.59 TCP 645 31643 → 52729 [PSH, ACK] Seq=1268 Ack=26 Win=82 Len=605
  253   6.732679 192.168.1.108 → 224.0.0.251  MDNS 77 Standard query response 0x0000 A, cache flush 192.168.1.108
  254   6.744376 192.168.1.59 → 106.2.59.95  TCP 40 52729 → 31643 [ACK] Seq=26 Ack=1873 Win=508 Len=0
  255   6.762926    127.0.0.1 → 127.0.0.1    TCP 42 9090 → 52533 [PSH, ACK] Seq=2042 Ack=85 Win=10214 Len=2
  256   6.762926    127.0.0.1 → 127.0.0.1    TCP 42 [TCP Retransmission] 9090 → 52533 [PSH, ACK] Seq=2042 Ack=85 Win=10214 Len=2
  257   6.762926    127.0.0.1 → 127.0.0.1    TCP 40 52533 → 9090 [ACK] Seq=85 Ack=2044 Win=9995 Len=0
  258   6.762926    127.0.0.1 → 127.0.0.1    TCP 40 [TCP Dup ACK 257#1] 52533 → 9090 [ACK] Seq=85 Ack=2044 Win=9995 Len=0
  259   6.762926    127.0.0.1 → 127.0.0.1    TCP 195 9090 → 52533 [PSH, ACK] Seq=2044 Ack=85 Win=10214 Len=155
  260   6.762926    127.0.0.1 → 127.0.0.1    TCP 195 [TCP Retransmission] 9090 → 52533 [PSH, ACK] Seq=2044 Ack=85 Win=10214 Len=155
  261   6.762926    127.0.0.1 → 127.0.0.1    TCP 40 52533 → 9090 [ACK] Seq=85 Ack=2199 Win=9994 Len=0
  262   6.762926    127.0.0.1 → 127.0.0.1    TCP 40 [TCP Dup ACK 261#1] 52533 → 9090 [ACK] Seq=85 Ack=2199 Win=9994 Len=0
  263   6.837635 192.168.1.30 → 224.0.0.251  MDNS 67 Standard query 0x0000 A BRWA86BAD339915.local, "QM" question
  264   6.837635 fe80::1020:985e:ac68:7850 → ff02::fb     MDNS 87 Standard query 0x0000 A BRWA86BAD339915.local, "QM" question
  265   7.204632  106.2.59.95 → 192.168.1.59 TCP 164 31643 → 52729 [PSH, ACK] Seq=1873 Ack=26 Win=82 Len=124
  266   7.245638 192.168.1.59 → 106.2.59.95  TCP 40 52729 → 31643 [ACK] Seq=26 Ack=1997 Win=508 Len=0
  267   7.305192  106.2.59.95 → 192.168.1.59 TCP 157 31643 → 52729 [PSH, ACK] Seq=1997 Ack=26 Win=82 Len=117
  268   7.345222 192.168.1.59 → 106.2.59.95  TCP 40 52729 → 31643 [ACK] Seq=26 Ack=2114 Win=507 Len=0
  269   7.478005    127.0.0.1 → 127.0.0.1    TCP 42 52533 → 9090 [PSH, ACK] Seq=85 Ack=2199 Win=9994 Len=2
  270   7.478005    127.0.0.1 → 127.0.0.1    TCP 42 [TCP Retransmission] 52533 → 9090 [PSH, ACK] Seq=85 Ack=2199 Win=9994 Len=2
  271   7.478005    127.0.0.1 → 127.0.0.1    TCP 40 9090 → 52533 [ACK] Seq=2199 Ack=87 Win=10214 Len=0
  272   7.478005    127.0.0.1 → 127.0.0.1    TCP 40 [TCP Dup ACK 271#1] 9090 → 52533 [ACK] Seq=2199 Ack=87 Win=10214 Len=0
  273   7.478005    127.0.0.1 → 127.0.0.1    TCP 42 9090 → 52533 [PSH, ACK] Seq=2199 Ack=87 Win=10214 Len=2
  274   7.478005    127.0.0.1 → 127.0.0.1    TCP 42 [TCP Retransmission] 9090 → 52533 [PSH, ACK] Seq=2199 Ack=87 Win=10214 Len=2
  275   7.478005    127.0.0.1 → 127.0.0.1    TCP 40 52533 → 9090 [ACK] Seq=87 Ack=2201 Win=9994 Len=0
  276   7.478005    127.0.0.1 → 127.0.0.1    TCP 40 [TCP Dup ACK 275#1] 52533 → 9090 [ACK] Seq=87 Ack=2201 Win=9994 Len=0
  277   7.478005    127.0.0.1 → 127.0.0.1    TCP 44 52533 → 9090 [PSH, ACK] Seq=87 Ack=2201 Win=9994 Len=4
  278   7.478005    127.0.0.1 → 127.0.0.1    TCP 44 [TCP Retransmission] 52533 → 9090 [PSH, ACK] Seq=87 Ack=2201 Win=9994 Len=4
  279   7.478005    127.0.0.1 → 127.0.0.1    TCP 40 9090 → 52533 [ACK] Seq=2201 Ack=91 Win=10214 Len=0
  280   7.478005    127.0.0.1 → 127.0.0.1    TCP 40 [TCP Dup ACK 279#1] 9090 → 52533 [ACK] Seq=2201 Ack=91 Win=10214 Len=0
  281   7.478005    127.0.0.1 → 127.0.0.1    TCP 42 52533 → 9090 [PSH, ACK] Seq=91 Ack=2201 Win=9994 Len=2
  282   7.478005    127.0.0.1 → 127.0.0.1    TCP 42 [TCP Retransmission] 52533 → 9090 [PSH, ACK] Seq=91 Ack=2201 Win=9994 Len=2
  283   7.478005    127.0.0.1 → 127.0.0.1    TCP 40 9090 → 52533 [ACK] Seq=2201 Ack=93 Win=10214 Len=0
  284   7.478005    127.0.0.1 → 127.0.0.1    TCP 40 [TCP Dup ACK 283#1] 9090 → 52533 [ACK] Seq=2201 Ack=93 Win=10214 Len=0
  285   7.478005    127.0.0.1 → 127.0.0.1    TCP 44 52533 → 9090 [PSH, ACK] Seq=93 Ack=2201 Win=9994 Len=4
  286   7.478005    127.0.0.1 → 127.0.0.1    TCP 44 [TCP Retransmission] 52533 → 9090 [PSH, ACK] Seq=93 Ack=2201 Win=9994 Len=4
  287   7.478005    127.0.0.1 → 127.0.0.1    TCP 40 9090 → 52533 [ACK] Seq=2201 Ack=97 Win=10214 Len=0
  288   7.478005    127.0.0.1 → 127.0.0.1    TCP 40 [TCP Dup ACK 287#1] 9090 → 52533 [ACK] Seq=2201 Ack=97 Win=10214 Len=0
  289   7.478981    127.0.0.1 → 127.0.0.1    TCP 195 9090 → 52533 [PSH, ACK] Seq=2201 Ack=97 Win=10214 Len=155
  290   7.478981    127.0.0.1 → 127.0.0.1    TCP 195 [TCP Retransmission] 9090 → 52533 [PSH, ACK] Seq=2201 Ack=97 Win=10214 Len=155
  291   7.478981    127.0.0.1 → 127.0.0.1    TCP 40 52533 → 9090 [ACK] Seq=97 Ack=2356 Win=9993 Len=0
  292   7.478981    127.0.0.1 → 127.0.0.1    TCP 40 [TCP Dup ACK 291#1] 52533 → 9090 [ACK] Seq=97 Ack=2356 Win=9993 Len=0
  293   7.786176    127.0.0.1 → 127.0.0.1    TCP 42 9090 → 52533 [PSH, ACK] Seq=2356 Ack=97 Win=10214 Len=2
  294   7.786176    127.0.0.1 → 127.0.0.1    TCP 42 [TCP Retransmission] 9090 → 52533 [PSH, ACK] Seq=2356 Ack=97 Win=10214 Len=2
  295   7.786176    127.0.0.1 → 127.0.0.1    TCP 40 52533 → 9090 [ACK] Seq=97 Ack=2358 Win=9993 Len=0
  296   7.786176    127.0.0.1 → 127.0.0.1    TCP 40 [TCP Dup ACK 295#1] 52533 → 9090 [ACK] Seq=97 Ack=2358 Win=9993 Len=0
  297   7.787152    127.0.0.1 → 127.0.0.1    TCP 195 9090 → 52533 [PSH, ACK] Seq=2358 Ack=97 Win=10214 Len=155
  298   7.787152    127.0.0.1 → 127.0.0.1    TCP 195 [TCP Retransmission] 9090 → 52533 [PSH, ACK] Seq=2358 Ack=97 Win=10214 Len=155
  299   7.787152    127.0.0.1 → 127.0.0.1    TCP 40 52533 → 9090 [ACK] Seq=97 Ack=2513 Win=9993 Len=0
  300   7.787152    127.0.0.1 → 127.0.0.1    TCP 40 [TCP Dup ACK 299#1] 52533 → 9090 [ACK] Seq=97 Ack=2513 Win=9993 Len=0
  301   7.860690 192.168.1.30 → 224.0.0.251  MDNS 67 Standard query 0x0000 A BRWA86BAD339915.local, "QM" question
  302   7.860690 fe80::1020:985e:ac68:7850 → ff02::fb     MDNS 87 Standard query 0x0000 A BRWA86BAD339915.local, "QM" question
  303   7.960821 192.168.1.108 → 224.0.0.251  MDNS 77 Standard query response 0x0000 A, cache flush 192.168.1.108
  304   8.033580 192.168.1.59 → 255.255.255.255 UDP 125 50445 → 10505 Len=97
  305   8.484569    127.0.0.1 → 127.0.0.1    TCP 42 52533 → 9090 [PSH, ACK] Seq=97 Ack=2513 Win=9993 Len=2
  306   8.484569    127.0.0.1 → 127.0.0.1    TCP 42 [TCP Retransmission] 52533 → 9090 [PSH, ACK] Seq=97 Ack=2513 Win=9993 Len=2
  307   8.484569    127.0.0.1 → 127.0.0.1    TCP 40 9090 → 52533 [ACK] Seq=2513 Ack=99 Win=10214 Len=0
  308   8.484569    127.0.0.1 → 127.0.0.1    TCP 40 [TCP Dup ACK 307#1] 9090 → 52533 [ACK] Seq=2513 Ack=99 Win=10214 Len=0
  309   8.484569    127.0.0.1 → 127.0.0.1    TCP 42 9090 → 52533 [PSH, ACK] Seq=2513 Ack=99 Win=10214 Len=2
  310   8.484569    127.0.0.1 → 127.0.0.1    TCP 44 52533 → 9090 [PSH, ACK] Seq=99 Ack=2513 Win=9993 Len=4
  311   8.484569    127.0.0.1 → 127.0.0.1    TCP 42 [TCP Retransmission] 9090 → 52533 [PSH, ACK] Seq=2513 Ack=99 Win=10214 Len=2
  312   8.484569    127.0.0.1 → 127.0.0.1    TCP 40 52533 → 9090 [ACK] Seq=103 Ack=2515 Win=9993 Len=0
  313   8.484569    127.0.0.1 → 127.0.0.1    TCP 44 [TCP Retransmission] 52533 → 9090 [PSH, ACK] Seq=99 Ack=2513 Win=9993 Len=4
  314   8.484569    127.0.0.1 → 127.0.0.1    TCP 40 52533 → 9090 [ACK] Seq=103 Ack=2515 Win=9993 Len=0
  315   8.484569    127.0.0.1 → 127.0.0.1    TCP 40 9090 → 52533 [ACK] Seq=2515 Ack=103 Win=10214 Len=0
  316   8.484569    127.0.0.1 → 127.0.0.1    TCP 40 [TCP Dup ACK 315#1] 9090 → 52533 [ACK] Seq=2515 Ack=103 Win=10214 Len=0
  317   8.484569    127.0.0.1 → 127.0.0.1    TCP 46 52533 → 9090 [PSH, ACK] Seq=103 Ack=2515 Win=9993 Len=6
  318   8.484569    127.0.0.1 → 127.0.0.1    TCP 46 [TCP Retransmission] 52533 → 9090 [PSH, ACK] Seq=103 Ack=2515 Win=9993 Len=6
  319   8.484569    127.0.0.1 → 127.0.0.1    TCP 40 9090 → 52533 [ACK] Seq=2515 Ack=109 Win=10214 Len=0
  320   8.484569    127.0.0.1 → 127.0.0.1    TCP 40 [TCP Dup ACK 319#1] 9090 → 52533 [ACK] Seq=2515 Ack=109 Win=10214 Len=0
  321   8.485545    127.0.0.1 → 127.0.0.1    TCP 195 9090 → 52533 [PSH, ACK] Seq=2515 Ack=109 Win=10214 Len=155
  322   8.485545    127.0.0.1 → 127.0.0.1    TCP 195 [TCP Retransmission] 9090 → 52533 [PSH, ACK] Seq=2515 Ack=109 Win=10214 Len=155
  323   8.485545    127.0.0.1 → 127.0.0.1    TCP 40 52533 → 9090 [ACK] Seq=109 Ack=2670 Win=9992 Len=0
  324   8.485545    127.0.0.1 → 127.0.0.1    TCP 40 [TCP Dup ACK 323#1] 52533 → 9090 [ACK] Seq=109 Ack=2670 Win=9992 Len=0
  325   8.786814    127.0.0.1 → 127.0.0.1    TCP 42 9090 → 52533 [PSH, ACK] Seq=2670 Ack=109 Win=10214 Len=2
  326   8.786814    127.0.0.1 → 127.0.0.1    TCP 42 [TCP Retransmission] 9090 → 52533 [PSH, ACK] Seq=2670 Ack=109 Win=10214 Len=2
  327   8.786814    127.0.0.1 → 127.0.0.1    TCP 40 52533 → 9090 [ACK] Seq=109 Ack=2672 Win=9992 Len=0
  328   8.786814    127.0.0.1 → 127.0.0.1    TCP 40 [TCP Dup ACK 327#1] 52533 → 9090 [ACK] Seq=109 Ack=2672 Win=9992 Len=0
  329   8.786814    127.0.0.1 → 127.0.0.1    TCP 195 9090 → 52533 [PSH, ACK] Seq=2672 Ack=109 Win=10214 Len=155
  330   8.786814    127.0.0.1 → 127.0.0.1    TCP 195 [TCP Retransmission] 9090 → 52533 [PSH, ACK] Seq=2672 Ack=109 Win=10214 Len=155
  331   8.786814    127.0.0.1 → 127.0.0.1    TCP 40 52533 → 9090 [ACK] Seq=109 Ack=2827 Win=9991 Len=0
  332   8.786814    127.0.0.1 → 127.0.0.1    TCP 40 [TCP Dup ACK 331#1] 52533 → 9090 [ACK] Seq=109 Ack=2827 Win=9991 Len=0
  333   8.814150 192.168.1.59 → 6.6.6.6      TCP 52 52952 → 443 [SYN] Seq=0 Win=64240 Len=0 MSS=1460 WS=256 SACK_PERM=1
  334   8.815127 192.168.1.59 → 6.6.6.6      TCP 52 52953 → 443 [SYN] Seq=0 Win=64240 Len=0 MSS=1460 WS=256 SACK_PERM=1
  335   8.815127 192.168.1.59 → 6.6.6.6      TCP 52 52954 → 443 [SYN] Seq=0 Win=64240 Len=0 MSS=1460 WS=256 SACK_PERM=1
  336   8.816104 192.168.1.59 → 6.6.6.6      TCP 52 52955 → 443 [SYN] Seq=0 Win=64240 Len=0 MSS=1460 WS=256 SACK_PERM=1
  337   8.816104 192.168.1.59 → 6.6.6.6      TCP 52 52956 → 443 [SYN] Seq=0 Win=64240 Len=0 MSS=1460 WS=256 SACK_PERM=1
  338   8.891281 192.168.1.59 → 6.6.6.6      TCP 52 52957 → 443 [SYN] Seq=0 Win=64240 Len=0 MSS=1460 WS=256 SACK_PERM=1
  339   9.306665  106.2.59.95 → 192.168.1.59 TCP 97 31643 → 52729 [PSH, ACK] Seq=2114 Ack=26 Win=82 Len=57
  340   9.348707 192.168.1.59 → 106.2.59.95  TCP 40 52729 → 31643 [ACK] Seq=26 Ack=2171 Win=513 Len=0
  341   9.496835    127.0.0.1 → 127.0.0.1    TCP 42 52533 → 9090 [PSH, ACK] Seq=109 Ack=2827 Win=9991 Len=2
  342   9.496835    127.0.0.1 → 127.0.0.1    TCP 42 [TCP Retransmission] 52533 → 9090 [PSH, ACK] Seq=109 Ack=2827 Win=9991 Len=2
  343   9.496835    127.0.0.1 → 127.0.0.1    TCP 40 9090 → 52533 [ACK] Seq=2827 Ack=111 Win=10214 Len=0
  344   9.496835    127.0.0.1 → 127.0.0.1    TCP 40 [TCP Dup ACK 343#1] 9090 → 52533 [ACK] Seq=2827 Ack=111 Win=10214 Len=0
  345   9.496835    127.0.0.1 → 127.0.0.1    TCP 42 9090 → 52533 [PSH, ACK] Seq=2827 Ack=111 Win=10214 Len=2
  346   9.496835    127.0.0.1 → 127.0.0.1    TCP 44 52533 → 9090 [PSH, ACK] Seq=111 Ack=2827 Win=9991 Len=4
  347   9.496835    127.0.0.1 → 127.0.0.1    TCP 44 [TCP Retransmission] 52533 → 9090 [PSH, ACK] Seq=111 Ack=2827 Win=9991 Len=4
  348   9.496835    127.0.0.1 → 127.0.0.1    TCP 40 9090 → 52533 [ACK] Seq=2829 Ack=115 Win=10214 Len=0
  349   9.496835    127.0.0.1 → 127.0.0.1    TCP 42 [TCP Retransmission] 9090 → 52533 [PSH, ACK] Seq=2827 Ack=111 Win=10214 Len=2
  350   9.496835    127.0.0.1 → 127.0.0.1    TCP 40 9090 → 52533 [ACK] Seq=2829 Ack=115 Win=10214 Len=0
  351   9.496835    127.0.0.1 → 127.0.0.1    TCP 40 52533 → 9090 [ACK] Seq=115 Ack=2829 Win=9991 Len=0
  352   9.496835    127.0.0.1 → 127.0.0.1    TCP 40 [TCP Dup ACK 351#1] 52533 → 9090 [ACK] Seq=115 Ack=2829 Win=9991 Len=0
  353   9.496835    127.0.0.1 → 127.0.0.1    TCP 42 52533 → 9090 [PSH, ACK] Seq=115 Ack=2829 Win=9991 Len=2
  354   9.496835    127.0.0.1 → 127.0.0.1    TCP 42 [TCP Retransmission] 52533 → 9090 [PSH, ACK] Seq=115 Ack=2829 Win=9991 Len=2
  355   9.496835    127.0.0.1 → 127.0.0.1    TCP 40 9090 → 52533 [ACK] Seq=2829 Ack=117 Win=10214 Len=0
  356   9.496835    127.0.0.1 → 127.0.0.1    TCP 40 [TCP Dup ACK 355#1] 9090 → 52533 [ACK] Seq=2829 Ack=117 Win=10214 Len=0
  357   9.496835    127.0.0.1 → 127.0.0.1    TCP 44 52533 → 9090 [PSH, ACK] Seq=117 Ack=2829 Win=9991 Len=4
  358   9.496835    127.0.0.1 → 127.0.0.1    TCP 44 [TCP Retransmission] 52533 → 9090 [PSH, ACK] Seq=117 Ack=2829 Win=9991 Len=4
  359   9.496835    127.0.0.1 → 127.0.0.1    TCP 40 9090 → 52533 [ACK] Seq=2829 Ack=121 Win=10214 Len=0
  360   9.496835    127.0.0.1 → 127.0.0.1    TCP 40 [TCP Dup ACK 359#1] 9090 → 52533 [ACK] Seq=2829 Ack=121 Win=10214 Len=0
  361   9.496835    127.0.0.1 → 127.0.0.1    TCP 195 9090 → 52533 [PSH, ACK] Seq=2829 Ack=121 Win=10214 Len=155
  362   9.496835    127.0.0.1 → 127.0.0.1    TCP 195 [TCP Retransmission] 9090 → 52533 [PSH, ACK] Seq=2829 Ack=121 Win=10214 Len=155
